{
  "schemaVersion": "plan-artifact/v1",
  "contractId": "plan-artifact.v1",
  "generatedAt": "2026-06-21T01:59:51.544Z",
  "source": {
    "repository": "itdojp/ae-framework",
    "prNumber": 3517,
    "baseRef": "main",
    "headRef": "feat/3509-agent-assurance-demo"
  },
  "goal": "Add a 15-minute offline BYO-agent assurance quickstart and local demo command for Issue #3509.",
  "scope": "Add the demo runner, package script, quickstart documentation, example README, and tests needed to generate local reviewer-first assurance artifacts without external agent or GitHub API calls.",
  "risk": {
    "selected": "risk:high",
    "requiresHumanApproval": true,
    "minHumanApprovals": 1
  },
  "assumptions": [
    {
      "id": "A1",
      "text": "The package.json change is limited to a new demo script entrypoint and does not modify dependency declarations or lockfiles."
    },
    {
      "id": "A2",
      "text": "The demo remains offline after pnpm dependencies are installed and does not require a GitHub token, hosted LLM API, or live PR."
    },
    {
      "id": "A3",
      "text": "Producer output is treated only as evidence input; generated policy output remains report-only for ordinary fast-lane changes."
    }
  ],
  "filesExpectedToChange": [
    "package.json",
    "scripts/demo/run-agent-assurance-demo.mjs",
    "scripts/assurance/aggregate-lanes.mjs",
    "tests/unit/scripts/agent-assurance-demo.test.ts",
    "docs/guides/byo-agent-assurance-quickstart.md",
    "docs/guides/byo-agent-assurance-onboarding.md",
    "examples/assurance-control-plane/agent-assurance-demo/README.md",
    "README.md",
    "docs/README.md",
    "artifacts/plan/plan-artifact.json",
    "artifacts/plan/plan-artifact.md"
  ],
  "verificationPlan": [
    {
      "id": "V1",
      "name": "Offline demo command",
      "command": "pnpm run demo:agent-assurance",
      "expectedEvidence": [
        "artifacts/review/agent-assurance-demo/assurance-review.md",
        "artifacts/policy/agent-assurance-demo/policy-gate-summary.json"
      ]
    },
    {
      "id": "V2",
      "name": "Demo runner and aggregate-lanes regression tests",
      "command": "pnpm vitest run tests/unit/scripts/agent-assurance-demo.test.ts tests/scripts/assurance-aggregate-lanes.test.ts --reporter dot",
      "expectedEvidence": [
        "tests/unit/scripts/agent-assurance-demo.test.ts"
      ]
    },
    {
      "id": "V3",
      "name": "Schema and JSON fixture validation",
      "command": "pnpm -s run check:schemas && node scripts/ci/validate-json.mjs",
      "expectedEvidence": [
        "schema/producer-normalization-summary.schema.json",
        "schema/assurance-summary.schema.json",
        "schema/policy-gate-summary-v1.schema.json"
      ]
    },
    {
      "id": "V4",
      "name": "Docs and Context Pack validation",
      "command": "pnpm -s run check:doc-consistency && pnpm -s run docs:lint && pnpm -s run context-pack:validate && pnpm -s run context-pack:verify-boundary-map",
      "expectedEvidence": [
        "docs/guides/byo-agent-assurance-quickstart.md",
        "spec/context-pack/boundary-map.json"
      ]
    }
  ],
  "rollbackPlan": "Revert the quickstart/demo commit and this plan artifact commit; remove generated demo artifacts from any local artifacts directory if present.",
  "requiredHumanInput": [
    "approval=plan-review"
  ],
  "notes": [
    "package.json is classified as high-risk by policy because it is a package manifest, but this change only adds a script entrypoint.",
    "run-security is requested so the policy label requirement for package manifest changes can be satisfied."
  ]
}
